{
  "schema_version": "0.1.8",
  "run_id": "92128e7f-727e-4a8d-a7a7-fe13b2b8c80e",
  "reference_period": "2026-09",
  "created_at": "2026-10-15T15:05:52.215619Z",
  "status": "PASS_WITH_WARNING",
  "hard_checks": [
    {
      "check_id": "DMI_OUTPUT_ALL_QUINTILES_PRESENT",
      "status": "PASS",
      "message": "All 5 quintiles present in output"
    },
    {
      "check_id": "DMI_VALUES_REASONABLE_RANGE",
      "status": "PASS",
      "message": "All DMI values in [0, 100]: range 11.03 to 11.36",
      "metrics": {
        "min": 11.026129838737823,
        "max": 11.358948294211505
      }
    },
    {
      "check_id": "INFLATION_VALUES_PRESENT",
      "status": "PASS",
      "message": "Inflation computed for all quintiles: range 3.43% to 3.76%",
      "metrics": {
        "min": 3.4261298387378236,
        "max": 3.758948294211506
      }
    },
    {
      "check_id": "CPI_CATEGORY_COVERAGE_COMPLETE",
      "status": "PASS",
      "message": "All 8 CPI categories present at t=2026-09",
      "metrics": {
        "categories_count": 8
      }
    },
    {
      "check_id": "WEIGHTS_SUM_TO_ONE",
      "status": "PASS",
      "message": "All quintile weights sum to 1.0 \u00b1 0.001"
    }
  ],
  "soft_checks": [
    {
      "check_id": "DMI_DISTRIBUTIONAL_GRADIENT",
      "status": "WARN",
      "message": "Unusual pattern: Q5 (11.36) > Q1 (11.03) - verify data",
      "metrics": {
        "q1_dmi": 11.026129838737823,
        "q5_dmi": 11.358948294211505
      }
    },
    {
      "check_id": "WEIGHTS_VINTAGE_AGE",
      "status": "WARN",
      "message": "Weights vintage age: 3 years (>2 years old, consider updating)",
      "metrics": {
        "weights_year": 2023,
        "reference_year": 2026,
        "age": 3
      }
    }
  ],
  "policy_gates": [
    {
      "gate_id": "CE_WEIGHTS_CONSERVATIVE_POLICY",
      "status": "WARN",
      "policy_ref": "ce_weights_policy_v0_1.json",
      "decision": {
        "weights_year": 2023,
        "reference_year": 2026,
        "is_current": false
      },
      "message": "Using 2023 weights for 2026 data (outdated - review needed)"
    }
  ],
  "warnings": [
    "Unusual pattern: Q5 (11.36) > Q1 (11.03) - verify data",
    "Weights vintage age: 3 years (>2 years old, consider updating)",
    "Using 2023 weights for 2026 data (outdated - review needed)"
  ],
  "errors": [],
  "summary": {
    "hard_fail_count": 0,
    "soft_warn_count": 2,
    "policy_fail_count": 0
  },
  "subject": {
    "specification": "slack_plus",
    "reference_period": "2026-09",
    "raw_artifact": "data/outputs/dmi_release_2026-09_slack_plus.json",
    "raw_sha256": "c11eda019db7a9653617c9f5fad9e4b48aa57c5ed5e516eb3d7af6cb6758abca"
  }
}